"清平乐·别来春半","五代","李煜","别来春半，触目柔肠断。砌下落梅如雪乱，拂了一身还满。('柔'肠断 一作：愁肠断)雁来音信无凭，路遥归梦难成。离恨恰如春草，更行更远还生。","宋词三百首，春天，写景，思乡","春半：即半春，春天的一半。别来春半：意思是，自分别以来，春天已过去一半，说明时光过得很快。柔肠：原指温柔的心肠，此指绵软情怀。砌（qì）下：台阶下。砌，台阶。落梅：指白梅花，开放较晚。全句意思是，台阶下飘落的白梅花犹如雪片纷飞。拂了一身还满：指把满身的落梅拂去了又落了满身。雁来音信无凭：这句话是说鸿雁虽然来了，却没将书信传来。古代有凭借雁足传递书信的故事。无凭：没有凭证，指没有书信。遥：远。归梦难成：指有家难回。恰如：《全唐诗》、《古今词统》、《古今诗余醉》等本中均作“却如”；毛本《尊前集》中作“怯如”。更行更远还生：更行更远，指行程越远。更，越。还生，还是生得很多。还，仍然，还是。","　　这首《清平乐》，表现了作者在恼人的春色中，触景生情，思念离家在外的亲人的情景。　　词的上片，开篇即直抒胸臆、毫无遮拦地道出郁抑于心的离愁别恨。一个“别”字，是起意，也是点题，单刀直入，紧扣人心。李煜前期作品中因各种原因，这种开篇直抒胸臆的不多，但中、后期作品中不少，想必是生活际遇之大变，作者的感情已如洪水注池、不泄不行罢。“春半”有人释为春已过半，有理，但如释为相别半春，亦有据，两义并取也无不可。接下二句承“触目”来，“砌下落梅如雪乱”突出一个“乱”字，既写出了主人公独立无语却又心乱如麻，也写出了触景伤情景如人意的独特感受，用生动的比喻把愁情说得明白如见。“拂了一身还满”，前有“拂”字，显见有主人公克制定念的想法，但一个“满”字，却把主人公那种无奈之苦、企盼之情、思念之深刻画得至真至实。上片的画面是情景交融、虚实相生而又动静结合的，直抒胸臆中见委婉含蓄，活泼喻象中透深沉凝重。　　他之所以久久地站在花下，是因为在思念远方的亲人。“雁来”两句把思念具体化。写出作者盼信，并希望能在梦中见到亲人。古代有大雁传书的故事。西汉时，苏武出使北方，被匈奴扣留多年。但他坚贞不屈。汉昭帝派使臣要匈奴释放苏武，匈奴谎说苏武已死。使臣知苏武未死，假称皇帝曾射下大雁，雁足上系有苏武的书信说他正在匈奴的某地。匈奴听了，只得将苏武放回。所以作者说，他看到大雁横空飞过，为它没有给自己带来书信而感到失望。他又设想，和亲人在梦中相会，但“路遥归梦难成”，距离实在是太遥远了，恐怕他的亲人在梦中也难以回来。古人认为人们在梦境中往往是相通的。对方作不成“归梦”，自己也就梦不到对方了。梦中一见都不可能，思念万分之情溢于言表，从而更强烈地表现了作者的思念之切。他怀着这种心情，向远处望去，望着那遍地滋生的春草，突然发现，“离恨却如春草，更行更远还生”。“更行更远”是说无论走得多么远，自己心中的“离恨”就像那无边无际、滋生不已的春草。无论人走到哪里，它们都在眼前，使人无法摆脱。这个结句，比喻浅显生动，而且通过形象给人以离恨无穷无尽、有增无已的感觉，使这首词读起来显得意味深长。　　全词以离愁别恨为中心，线索明晰而内蕴，上下两片浑成一体而又层层递进，感情的抒发和情绪的渲染都十分到位。作者手法自然，笔力透彻，尤其在喻象上独到而别致，使这首词具备了不同凡品的艺术魅力。","离别以来，春天已经过去一半，映入目中的景色掠起柔肠寸断。阶下落梅就像飘飞的白雪一样零乱，把它拂去了又飘洒得一身满满。鸿雁已经飞回而音信毫无依凭，路途遥远，要回去的梦也难形成。离别的愁恨正像春天的野草，越行越远它越是繁生。"
"虞美人·风回小院庭芜绿","五代","李煜","风回小院庭芜绿，柳眼春相续。凭阑半日独无言，依旧竹声新月似当年。笙歌未散尊罍在，池面冰初解。烛明香暗画堂深，满鬓青霜残雪思难任。","宋词三百首，春天，写景，怀旧","⑴虞美人：词牌名。原为唐教坊曲，初咏项羽宠姬虞美人，因以为名。又名《一江春水》、《玉壶水》、《巫山十二峰》等。双调，五十六字，上下片各四句，皆为两仄韵转两平韵。⑵风：指春风。庭芜：庭院里的草。芜，丛生的杂草。⑶柳眼：早春时柳树初生的嫩叶，好像人的睡眼初展，故称柳眼。李商隐《二月二日》诗中有“花须柳眼多无赖，紫蝶黄蜂俱有情”之句。春相续：一年又一年的春天继续来到人间。⑷凭阑：靠着栏杆。⑸竹声：竹制管乐器发出的声音。竹，古乐八晋之一，指竹制管乐器，箫、管、笙、笛之类。一说“竹声”为风吹竹叶之声。⑹笙歌：泛指奏乐唱歌，这里指乐曲。尊罍（léi）在：意谓酒席未散，还在继续。尊罍，一作“尊前”。尊，酒杯，罍，一种酒器，小口大肚，有盖，上部有一对环耳，下部有一鼻可系。⑺池面冰初解：池水冰面初开，指时已初春。⑻烛明香暗：是指夜深之时。香，熏香。画堂：一作“画歌”，一作“画楼”；一作“画阑”。指华丽而精美的君室。深：一作“声”，指幽深。⑼清霜残雪：形容鬓发苍白，如同霜雪，谓年已衰老。思难任（rèn）：忧思令人难以承受，即指极度忧伤。思，忧思。难任，难以承受。任：一作“禁”。","　　开头称春风又回到小院里来，院子里的草又绿了。院子里的柳条上新生柳叶，细长如人睡眼初展，这样的柳叶在春天到来时，连续着生出来。这里写出小院中春天的信息，可以从庭草的绿色里，从柳叶的舒展和相续生出中看出来。“柳眼春相续”，写得很细，是诗人的观察。这里也透露出他的寂寞之感来。他在《玉楼春》里写在金陵时的春天景象：“晚妆初了明肌雪，春殿嫔娥鱼贯列。凤箫吹断水云闲，重按霓裳歌遍彻。”是盛极一时，跟被拘留中的寂寞正好构成对照。想起当日的情况，靠着栏杆半天没有一句话，透露他对故国之思的痛苦心情。这时想替自己排解，说风吹竹子的声音和新月的照耀还象当年。想来小院中还有竹子，春风吹来，还有竹声。不过跟《玉楼春》写的“醉拍阑干情味切”相比，这时的“半日独无言”又构成鲜明的对照了。　　下半片写他在赐第里还有故妓，还可以奏乐。笙歌未散，酒杯还在，还可以喝酒。春天到来，池面冰开始融化了。就他的处境来说，也许也像东风解冻。“烛明香暗画堂深，满鬓清霜残雪思难任。”用“烛明香暗”来陪衬“画堂深”，用“满鬓清霜残雪”的霜雪来反衬东风解冻的“冰初解”。“画堂深”是深沉，看来故妓的奏乐也是寂寞中的聊以自慰，不能跟“凤箫吹断水云闲，重按霓裳歌遍彻”相比，所以无法解除寂寞，因此有画堂深沉的感觉。东风解冻透露春天的气息，但对他说来，春天永远过去了，这表现在四十岁光景的人已经是满鬓霜雪了，这里含有对故国的怀念、亡国的痛苦难以负担。这首词，结合被俘后的生活来反映故国之思，写春天的到来，东风的解冻，都无法减轻他的痛苦。","春风吹回来了，庭院里的杂草变绿了，柳树也生出了嫩叶，一年又一年的春天继续来到人间。独自依靠着栏杆半天没有话说，那吹箫之声和刚刚升起的月亮和往年差不多。乐曲演奏未完，酒宴未散，仍在继续，池水冰面初开。夜深之时，华丽而精美的君室也变得幽深。我已年老，忧思难以承受啊。"
"破阵子·四十年来家国","五代","李煜","四十年来家国，三千里地山河。凤阁龙楼连霄汉，玉树琼枝作烟萝，几曾识干戈？一旦归为臣虏，沈腰潘鬓消磨。最是仓皇辞庙日，教坊犹奏别离歌，垂泪对宫娥。","宋词三百首，豪放，典故，留恋，感伤","破阵子：词牌名。四十年：南唐自建国至李煜作此词，为三十八年。此处四十年为概数。凤阁：别作“凤阙”。凤阁龙楼指帝王能够居所。霄汉：天河。玉树琼枝：别作“琼枝玉树”，形容树的美好。烟萝：形容树枝叶繁茂，如同笼罩着雾气。识干戈：经历战争。识，别作“惯”。干戈：武器，此处指代战争。沈腰潘鬓：沈指沈约。后用沈腰指代人日渐消瘦。潘：指潘岳。后以潘鬓指代中年白发。辞庙：辞，离开。庙，宗庙，古代帝王供奉祖先牌位的地方。犹奏：别作“独奏”。垂泪：别作“挥泪”。","　　此词上片写南唐曾有的繁华，建国四十余年，国土三千里地，居住的楼阁高耸入云霄，庭内花繁树茂。这片繁荣的土地，几曾经历过战乱的侵扰。几句话，看似只是平平无奇的写实，但却饱含了多少对故国的自豪与留恋。“几曾识干戈”，更抒发了多少自责与悔恨。下片写国破。“一旦”二字承上片“几曾”之句意，笔锋一叠，而悔恨之意更甚。终有一天国破家亡，人不由得消瘦苍老，尤其是拜别祖先的那天，匆忙之中，偏偏又听到教坊里演奏别离的曲子，又增伤感，不禁面对宫女恸哭垂泪。　　“沈腰”暗喻自己像沈约一样，腰瘦得使皮革腰带常常移孔，而“潘鬓”则暗喻词人自己像潘岳一样，年纪不到四十就出现了鬓边的白发。连着这两个典故，描写词人内心的愁苦凄楚，人憔悴消瘦，鬓边也开始变白，从外貌变化写出了内心的极度痛苦。古人说忧能伤人，亡国之痛，臣虏之辱，使得这个本来工愁善感的国君身心俱敝。李煜被俘之后，日夕以眼泪洗面，过着含悲饮恨的生活。这两个典故即是他被虏到汴京后的辛酸写照。　　此词上片写繁华，下片写亡国，由建国写到亡国，极盛转而极衰，极喜而后极悲。中间用“几曾”“一旦”二词贯穿转折，转得不露痕迹，却有千钧之力，悔恨之情溢于言表。作者以阶下囚的身份对亡国往事作痛定思痛之想，自然不胜感慨系之。此词回顾事国时的繁华逸乐：那四十年来的家国基业；三千里地的辽阔疆域，竟都沉浸在一片享乐安逸之中。“几曾识干戈”既是其不知珍惜的结果，同时也是沦为臣虏的原因。记叙离别故国时哭辞宗庙的情景，写来尤为沉痛惨怛。其事虽见载于《东坡志林》但出自后主之手，更觉凄惨苦涩，不失为一个丧国之君内心的痛苦自白。","南唐开国已有四十年历史，幅员辽阔。宫殿高大雄伟，可与天际相接，宫苑内珍贵的草木茂盛，就像罩在烟雾里的女萝。在这种奢侈的生活里，我哪里知道有战争这回事呢？自从做了俘虏，我因为在忧虑伤痛的折磨中过日子而腰肢减瘦、鬓发斑白。最使我记得的是慌张地辞别宗庙的时候，宫廷里的音乐机关/教坊的乐工们还奏起别离的歌曲，这种生离死别的情形，令我悲伤欲绝，只能面对宫女们垂泪而已。"
"蝶恋花·春暮","五代","李煜","遥夜亭皋闲信步。才过清明，渐觉伤春暮。数点雨声风约住。朦胧淡月云来去。桃杏依稀香暗渡。谁在秋千，笑里轻轻语。一寸相思千万绪。人间没个安排处。","婉约，闺怨，思念","蝶恋花，词牌名，分上下两阕，共六十个字，一般用来填写多愁善感和缠绵悱恻的内容。此词于《唐宋诸贤绝妙词选》、《类编草堂诗余》、《词的》、《古今诗余醉》等本中均有题作“春暮”。遥夜：长夜。亭皋：水边的平地。《汉书·司马相如传上》：“亭皋千里，靡不被筑。”闲：吴本《二主词》误作“闭”。信：吴讷本、吕远本、侯文灿本《南唐二主词》作“倒”。王仲闻《南唐二主词校订》云：“倒步不可解，必信步之误。”刘继增《南唐二主词笺》云：“旧钞本作信。”风约住：下了几点雨又停住，就象雨被风管束住似的。杏：《尊前集》、《唐宋诸贤绝妙词选》、《类编草堂诗余》、《词的》、《古今词统》作“杏”。《欧阳文忠近体乐府》注：“一作杏。”依依：《欧阳文忠公近体乐府》、《醉翁琴趣外篇》、《乐府雅词》、《花庵词选》、《类编草堂诗余》、《唐宋诸贤绝妙词选》、毛订《草堂诗余》、《词的》、《古今词统》均作“依稀”。《欧阳文忠近体乐府》罗泌校语云：“一作无言。”暗度：不知不觉中过去。春暗度：《尊前集》作“风暗度”。《欧阳文忠近体乐府》、《花庵词选》、《醉翁琴趣外篇》、《乐府雅词》、《唐宋诸贤绝妙词选》、《类编草堂诗余》、《词的》、《古今词统》、《古今诗余醉》、《历代诗余》、《全唐诗》作“香暗度”。谁：《乐府雅词》作“谁”。《欧阳文忠公近体乐府》罗泌校语云：“谁，一作人。”在：《欧阳文忠公近体乐府》、《醉翁琴趣外篇》、《乐府雅词》作“上”。《欧阳文忠公近体乐府》注：“一作在。”一寸：指心，喻其小。绪：连绵不断的情丝。“千万绪”有千丝万缕的意思。安排：安置，安放。","","夜间在亭台上踱着步子，不知道为何清明刚过，便已经感觉到了春天逝去的气息。夜里飘来零零落落的几点雨滴，月亮在云朵的环绕下，散发着朦胧的光泽。桃花、杏花在暗夜的空气中散发着幽香，不知道在园内荡着秋千，轻声说笑的女子是谁？对她千万般思念，在辽阔的天地里，竟无一处可以安排“我”的相思愁绪。"
"鹊踏枝·六曲阑干偎碧树","五代","冯延巳","六曲阑干偎碧树，杨柳风轻，展尽黄金缕。谁把钿筝移玉柱，穿帘海燕双飞去。满眼游丝兼落絮，红杏开时，一霎清明雨。浓睡觉来莺乱语，惊残好梦无寻处。","清明节，写景，回忆，伤怀","偎：紧靠着。黄金缕：形容嫩黄的柳条，如同丝丝金线一般。钿筝：用金翠宝石装饰的筝，玉柱：筝上定弦用的玉制码子。海燕：传说燕子来自海上，故称“海燕”。双飞，一作“晾飞”。以上两句是写有人弹起筝来，双燕由帘内惊起飞走。游丝：指在空中飞扬的虫丝。落絮：指飘落的柳絮。一霎（sha）：一阵子。唐孟郊《春后雨》诗：“昨夜一霎雨，天意苏群物。”觉来：醒来。莺乱语，一作“慵不语”。","　　这首词是拟写闺情之作，全篇以写景始而以情终，景中含情，情又衬景，因而被评为“金碧山水，一片空蒙。”（谭献《谭评词辨》）　　上阕从春光写起。“六曲阑干”三句极力描写庭院的春日明媚风景。曲曲红阑，被绿茵扶疏的碧树所环绕；院中的杨柳随风摇摆，如丝如缕的柔条在夕阳的晚照中轻盈飞舞，好一派静谧、优美的景色。一个“偎”字，写出自然景物与人工景物的和谐、亲昵，一个“展”字，写尽了柳条的媚态，词的意境，就在这柔和、清雅的景物中被烘托出。而突如其来的琮琮筝声，打破了这安静的氛围，也惊起了双燕，穿帘而去。由燕子的安居，可知闺中的冷清；由筝声的惊燕，可知声音之激越，弹筝者心情之郁闷也可见一斑。尽管全部是写景，但闺中人独处的难堪之情已经隐约可见。上阕中词人分别从听觉和视觉两个角度进行描写，先写筝鸣声之凄婉，再写成双的海燕穿帘而去，所见所闻，勾起词人隐隐的孤独与惆怅之感，为下文进一步抒情做铺垫。　　下片抒伤春之情。首三句写词人所见：游丝、落絮、红杏花，这些景物的描写，暗示春之将逝。依旧由景开始，但是“满眼”一词已经凸现了人的出现，是从闺中人的视线和心情来看景了。“游丝”和“落絮”都是经典的春愁缭乱、幽思绵绵的意象，“满”和“兼”字更说明了一种无聊、无奈的心情。这是突然降下的一阵清明雨，打得院中杏花零落。最后一句由春光缭绕归结到春闺的愁思，一个“乱”字说明了心绪之乱，“无寻处”则点出了好梦被惊醒后的烦恼与忧愁。经过这两句一点化，前面的景语全都变成了情语，令人回味不已。　　整首词诗人由写景始，由写人终。写景抓住春天的特指，但有富于变化，在变化中蕴含了作者的情感，写人先写人物的行动，把细筝移玉柱，但穿帘双燕却勾起了主人公无限的伤感，成为全词感情转折的基点。再写人物的心理，“惊残好梦无寻处”，直接抒发主人公内心的伤感。整首词写景与写人相互交融，通过穿帘的双燕，乱语的“黄莺”、“游丝”、“落絮”“清明雨”，使人物的心理活动步步呈现，达到了情与景的高度统一，但又含而不露，堪称“金碧山水，一片空蒙。”全词在艺术风格上语言明丽，用意婉曲。","在绿阴丛中，一座别致、幽静的小楼悄然独立，曲曲折折的栏杆紧紧依偎着碧树，两者相映成趣。春风和煦轻柔，鹅黄嫩绿、如丝如缕的杨柳在风中款款摆动腰肢，摇曳多姿。春光明媚，晴空万里，游丝袅袅，柳絮翻飞，这已是暮春景象了，正当杏花盛开，娇艳无比之际，却下起了一阵小雨。在如此深重的幽情之中，她不由沉沉睡去，正在睡酣梦甜之际，却被窗外清脆的莺啼声惊起，而美梦也再也无寻处了。"
"乌夜啼·昨夜风兼雨","五代","李煜","昨夜风兼雨，帘帏飒飒秋声。烛残漏断频欹枕，起坐不能平。　世事漫随流水，算来一梦浮生。醉乡路稳宜频到，此外不堪行。(一梦 一作：梦里)","宋词三百首，写风，写雨，抒情，人生","兼：同有，还有。帘帏（wéi）：帘子和帐子。帘，用布、竹、苇等做的遮蔽门窗的东西。帏，同帷，帐子，幔幕，一般用纱、布制成。飒飒（sà）：象声词，这里形容风吹帘帏发出的声音。烛残：蜡烛燃烧将尽。残，尽，竭。漏断：漏壶中的水已经滴尽，表示时间已经很晚。漏，漏壶，为古代计时的器具，用铜制成。壶上下分好几层，上层底有小孔，可以滴水，层层下注，以底层蓄水多少计算时问。频：时常，频繁。欹（qī）枕：通彀，斜，倾斜。欹枕，头斜靠在枕头上。平：指内心平静。世事：指人世间的各种各样的事情。漫：枉然，徒然。浮生：指人生短促，世事虚浮不定。浮，这里为短暂、空虚之意。醉乡：指人醉酒时神志不清的状态。稳：平稳，稳当。宜，应当。不堪行：不能行。堪，能够。","　　词的上片，主要写作者的凄苦境遇和无奈情态。“昨夜风兼雨”，不从日而偏从夜写起，是写作者悲怀愁思的夜不能寐，“风兼雨”与“飒飒秋声”相对应，是渲染环境、气氛。在这种凄凉寒苦的景色中，作者的心境是可想而知的。之所以说“昨夜”，当还有一种不堪回首的感触在其中罢。这里虽然客观的写景，但主人公的形象，尤其是他的彷徨、郁闷的心情却已隐然可见。接下来二句就是直写了。李煜在《喜迁莺·晓月坠》中曾有“无语枕频欹”之句，与此句“烛残漏断频欹枕”用意相同，但所思不同。以前是怀想佳人，君存情爱在先，如今却是是国破家亡成阶下之囚，境遇不同，感触自是相异，于是看“烛残”、听“漏断”，虽然仍是“无语”，但却已是“起坐不能平”了。“不能平”的不是身体，而是心境，这一次是连梦都没有了。上片虽似写景为主，描摹情状，但事实上作者那种愁思如潮、郁抑满怀的心情却已淋漓尽致地表现出来，深沉而又挚切。　　词的下片以抒情为主，抒发作者的切肤之痛和人生感慨。这既是“起坐不能平”的原因，也是“起坐不能平”中思前想后的结论。“世事漫随流水，算来梦里浮生”，昨日一国之君，今日阶下之囚；昨夜欢歌笑语，今夜“烛残漏断”，明日明夜呢？作者的苦痛遭遇，不能不使他有人生如梦的感慨和浩叹。一个“漫”字，极空虚，极幻妄，准确地传达了作者的万千思绪。一个“算来”，既说明作者是总结回顾了自己的过去得出的结论，但同时也传达出作者的那种十分迷惘、无奈的心情，同“漫”字一样地生动、传神。作者的这种慨叹是沉痛的，但同时也是消极的，于是作者宁愿醉去不醒，宁愿迷迷糊糊，“醉乡路稳宜频到”，原来作者指望的是一个“稳”字，一语道破天机，作者处境的危险困苦不言自明。所以我们并不能从这个角度太过严厉地去批评李煜的颓废消极思想，环境使然，差可理解。更何况即便如此，李煜也仍是难逃恶运，不久于世。　　全词比较鲜明地体现了李煜后期作品的特色：情感真实，清新自然。尤其是这首词，作者对自己的苦痛毫不掩饰，把自己的人生感慨明白写出，不假饰，不矫情，简洁质朴，有现实感，虽然思想情调不高，但艺术价值不低。","昨天的夜晚，风雨交加， 遮窗的帐子被秋风吹出飒飒的声响，窗户外传来了令人心烦的风声雨声，整整响了一夜。蜡烛燃烧的所剩无几，壶中水已漏尽，我不停的多次起来斜靠在枕头上。 躺下坐起来思绪都不能够平稳。人世间的事情，如同流水东逝，说过去就过去了，想一想我这一生，就像做了一场大梦，以前的荣华富贵生活已一去不复返了。醉乡道路平坦，也无忧愁，可常去，别的地方不能去。"
"忆江南·多少恨","五代","李煜","多少恨，昨夜梦魂中。还似旧时游上苑，车如流水马如龙。花月正春风。","婉约，记梦，思国","望江南：《全唐诗》、《词谱》等均作《忆江南》。梦魂：古人认为在睡梦中人的灵魂会离开肉体，故称“梦魂”。还似：一作“还是”。上苑：封建时代供帝王玩赏、打猎的园林。车如流水马如龙：意思是车子接连不断像流水一样驰过，马匹络绎不绝像一条龙一样走动。形容车马络绎不绝，十分繁华热闹。花月：花和月，泛指美好的景色。花月正春风，意思是形容春天鲜花怒放，春夜月光明朗，春风微拂的情景，描绘春光的明媚。","","我有多少的恨，昨夜梦中的景象，还像以前我还是故国君主时，常在上苑游玩，车子如流水穿过，马队像长龙一样川流不息。正是景色优美的春天，还吹着融融的春风。"
