"鹊踏枝·谁道闲情抛掷久","五代","冯延巳","谁道闲情抛掷久？每到春来，惆怅还依旧。日日花前常病酒，敢辞镜里朱颜瘦。(敢辞 一作：不辞)河畔青芜堤上柳，为问新愁，何事年年有？独立小桥风满袖，平林新月人归后。","宋词三百首，婉约，春愁，感叹，人生","清王鹏运《半塘丁稿·鹜翁集》云：“冯正中《鹤踏枝》十四首，郁伊倘况，义兼比兴。”调名即《蝶恋花》。谁道句：近人梁启超云：“稼轩《摸鱼儿》起处从此脱胎。文前有文，如黄河液流，莫穷其源。”（《阳春集笺》引）。闲情：即闲愁、春愁。病酒：饮酒过量引起身体不适。敢辞：不避、不怕。朱颜，青春红润的面色。朱颜：这里指红润的脸色。青芜：青草。平林：平原上的树林。李白《菩萨蛮》：“平林澳漠烟如织。”新月：阴历每月初出的弯形月亮。","　　这是一首表达孤寂惆怅的言情词。全词所写的乃是心中一种常存永在的惆怅、忧愁，而且充满了独自一人承担的孤寂、凄冷之感，不仅传达了一种感情的意境，而且表现出强烈而鲜明的个性，意蕴深远，感发幽微。　　上阕开门见山，首句用反问的句式把这种既欲抛弃却又不得忘记的“闲情”提了出来，整个上片始终紧扣首句提出的复杂矛盾的心情回环反复，表现了作者内心感情的痛苦撕咬。　　“谁道闲情抛掷久。”虽然仅只七个字，然而却写得千回百转，表现了在感情方面欲抛不得的一种盘旋郁结的挣扎的痛苦。而对此种感情之所由来，却又并没有明白指说，而只用了“闲情”两个字。这种莫知其所自来的“闲情”才是最苦的，而这种无端的“闲情”对于某些多情善感的诗人而言，却正是如同山之有崖、木之有枝一样的与生俱来而无法摆脱的。词人在此一句词的开端先用了“谁道”两个字，“谁道”者，原以为可以做到，谁知竟未能做到，故以反问之语气出之，有此二字，于是下面的“闲情抛弃久”五字所表现的挣扎努力就全属于徒然落空了。　　“每到春来，惆怅还依旧。”上面着一“每”字，下面着一“还”，字，再加上后面的“依旧”两个字，已足可见此“惆怅”之永在长存。而“每到春来”者，春季乃万物萌生之时，正是生命与感情觉醒的季节，词人于春心觉醒之时，所写的却并非如一般人之属于现实的相思离别之情，而只是含蓄地用了“惆怅”二字。“惆怅”者，是内心恍如有所失落又恍如有所追寻的一种迷惘的情意，不像相思离别之拘于某人某事，而是较之相思离别更为寂寞、更为无奈的一种情绪。　　“日日花前常病酒，敢辞镜里朱颜瘦。”既然有此无奈的惆怅，而且经过抛弃的挣扎努力之后而依然永在长存，于是下面两句冯氏遂径以殉身无悔的口气，说出了“日日花前常病酒，不辞镜里朱颜瘦”两句决心一意承担负荷的话来。上面更着以“日日”两字，更可见出此一份惆怅之情之对花难遣，故唯有“日日”饮酒而已。曰“日日”，盖弥见其除饮酒外之无以度日也。至于下句之“镜里朱颜瘦”，则正是“日日病酒”之生活的必然结果。曰“镜里”，自有一份反省惊心之意，而上面却依然用了“不辞”二字，昔《离骚》有句云“虽九死其犹未悔”，“不辞”二字所表现的，就正是一种虽殉身而无悔的情意。　　下阕进一步抒发这种与时常新的闲情愁绪。词人把这种迷惘与困惑又直接以疑问的形式再次鲜明突出地揭诸笔端，可谓真率之极；而在“河畔青芜堤上柳”的意象之中，隐含着绵远纤柔、无穷无尽的情意与思绪，又可谓幽微之至。　　“河畔青芜堤上柳。”下半阕承以“河畔青芜堤上柳”一句为开端，在这首词中实在只有这七个字是完全写景的句子，但此七字却又并不是真正只写景物的句子，不过只是以景物为感情之衬托而已。所以虽写春来之景色，却并不写繁枝嫩蕊的万紫千红，只说“青芜”，只说“柳”。“芜”者，丛茂之草也，“芜”的青青草色既然遍接天涯，“柳”的缕缕柔条，更是万丝飘拂。簇这种绿遍天涯的无穷草色，这种’随风飘拂的无尽柔条，它们所唤起的，或者所象喻的，该是一种何等绵远纤柔的情意。而这种草色又不自今日方始，年年河畔草青，年年堤边柳绿，则此一份绵远纤柔的情意，也就年年与之无尽无穷。　　“为问新愁，何事年年有。”所以下面接下去就说了“为问新愁，何事年年有”二句，正式从年年的芜青柳绿，写到“年年有”的“新愁”。虽是“年年有”的“愁”，却又说是“新”，一则此词开端已曾说过“闲情抛弃久”的话，经过一段“抛弃”的挣扎，而重新又复苏起来的“愁”，所以说“新”；再则此愁虽一宋词鉴赏辞典一旧，而其令人惆怅的感受，则敏锐深切岁岁常新，故曰“新”。上面用了“为问”二字，下面又用了“何事”二字，造成了一种强烈的疑问语气，从其尝试抛弃之徒劳的挣扎，到问其新愁之何以年年常有，有如此之挣扎与反省而依然不能自解。在此强烈的追问之后，词人却忽然荡开笔墨，更不作任何回答，而只写下了“独立小桥风满袖，平林新月人归后”两句身外的景物情事，仔细玩味，这十四个字却实在是把惆怅之情写得极深。　　“独立小桥风满袖，平林新月人归后。”试观其“独立”二字，已是寂寞可想，再观其“风满袖”三字，更是凄寒可知，又用了“小桥”二字，则其立身之地的孤伶无所荫蔽亦复如在眼前，而且“风满袖”一句之“满”字，写风寒袭人，也写得极饱满有力。在如此寂寞孤伶无所荫蔽的凄寒之侵袭下，其心情之寂寞凄苦已可想见，何况又加上了下面的“平林新月人归后”七个字。“平林新月”，则林梢月上，夜色渐起，“人归后”，则路断行人，已是寂寥人定之后了。从前面所写的“河畔青芜”之颜色鲜明来看，应该乃是白日之景象，而此一句则直写到月升人定，则诗人承受着满袖风寒在小桥上独立的时间之长久也可以想见了。如果不是内心中有一份难以排解的情绪，有谁会在寒风冷露的小桥上直立到中宵呢？","谁说闲情逸致被忘记了太久？每到新春来到，我的惆怅心绪一如故旧。为了消除这种闲愁，我天天在花前痛饮，让自己放任大醉，不惜身体消瘦，对着镜子自己容颜已改。河边上芳草萋萋，河岸上柳树成荫。见到如此美景，我忧伤地暗自思量，为何年年都会新添忧愁？我独立在小桥的桥头，清风吹拂着衣袖。只有远处那一排排树木在暗淡的月光下影影绰绰，与我相伴。"
"长命女·春日宴","五代","冯延巳","春日宴，绿酒一杯歌一遍。再拜陈三愿：一愿郎君千岁，二愿妾身常健，三愿如同梁上燕，岁岁长相见。","宋词三百首，婉约，夫妻，饮酒，祝愿","长命女：唐教坊曲名用作词调名。全词39字，上片三句三仄韵，下片四句仄韵。绿酒：古时米酒酿成未滤时，面浮米渣，呈淡绿色，故名。妾身：古时女子队自己的谦称。岁岁：年年，即每年。","　　这首词实际是祝酒词，描写春日开宴时，夫妇双方祝酒陈愿。前两愿分别祝郎君与自己长寿健康，第一愿以梁燕双柄喻夫妻团圆，天长地久。冯词三愿对于人问恩爱夫妇而苦则相当典型，主人公不求富贵．惟愿夫妇相守长久，意愿虽强而所求不奢，表现了古代女子对美满生活的追求。　　在具体描写上。本词不但通过人物的语言来抒情，而且通过相应的具体环境描写来烘托人物的思想感情。春日、绿酒、情歌、呢喃燕语，构成了极美的意境，对于爱情的抒写是极有力的烘托。　　整首词采用妇人口吻，语言清新明丽，语浅情深，可谓做到单纯与丰富富、平易与雅致高度统一，深得民歌精髓，化平凡为神奇，艺术效果奇妙。","风和日丽的春天，摆起丰盛的酒宴。一杯美酒一曲歌呵，拜了又拜许三愿：一愿郎君你长寿千岁，二愿我身体永远康健，三愿我俩如同梁上燕呀，双双对对，幸福无边。"
"谒金门·风乍起","五代","冯延巳","风乍起，吹皱一池春水。闲引鸳鸯香径里，手挼红杏蕊。斗鸭阑干独倚，碧玉搔头斜坠。终日望君君不至，举头闻鹊喜。","宋词三百首，婉约，写景，惜别，留恋","谒金门：词牌名。乍：忽然。闲引：无聊地逗引着玩。挼：揉搓。斗鸭：以鸭相斗为欢乐。斗鸭阑和斗鸡台，都是官僚显贵取乐的场所。独：一作“遍”碧玉搔头：一种碧玉做的簪子。《西京杂记》载：“（汉）武帝过李夫人，就取玉簪搔头；自此后，宫人搔头皆用玉。”","　　冯延巳擅长以景托情，因物起兴的手法，蕴藏个人的哀怨。写得清丽、细密、委婉、含蓄。这首脍炙人口的怀春小词，在当时就很为人称道。尤其“风乍起，吹绉一池春水”，是传诵古今的名句。词的上片，以写景为主，点明时令、环境及人物活动。下片以抒情为主，并点明所以烦愁的原因。　　春风乍起，吹皱了一池碧水，这本是春日平常得很的景象。可是有谁知道，这一圈圈的涟漪，却搅动了一位女性的感情波澜。别看她貌似悠闲，时而逗引鸳鸯，时而揉扯花蕊，过一会儿又倚身在池栏上观看斗鸭，但只需要从她懒洋洋的神态上，我们就知她的心思其实全不在此。随着几声喜鹊的欢叫，她的面庞儿顿时就涌上了一阵红晕----盼念已久的丈夫终于回家了，这怎能不令她的心像小鹿儿那样乱撞乱跳？","春风乍起，吹皱了一池碧水。（我）闲来无事，在花间小径里逗引池中的鸳鸯，随手折下杏花蕊把它轻轻揉碎。独自倚靠在池边的栏杆上观看斗鸭，头上的碧玉簪斜垂下来。（我）整日思念心上人，但心上人始终不见回来，（正在愁闷时），忽然听到喜鹊的叫声。"
"清平乐·雨晴烟晚","五代","冯延巳","雨晴烟晚。绿水新池满。双燕飞来垂柳院，小阁画帘高卷。黄昏独倚朱阑。西南新月眉弯。砌下落花风起，罗衣特地春寒。","宋词三百首，婉约，写景，妇女，孤独，思念","砌：台阶。特地：特别。砌：台阶。朱阑：一作“朱栏”，红色的栏杆。","　　这是一首抒写闺情的词作，写的是一个少妇在暮春时节的一个黄昏，思念亲人并等待他归来的情景。　　词的上片写明节候、环境以及这位少妇所见的景物特色。　　“雨晴烟晚，绿水新池满”一个“晚”字点名时间；“绿水”二字交待气候-----此时正值春天。这两句乃是写寻常春景：雨后放晴，夕阳残照，烟霭空濛一片，暮色中但见新池绿水盈盈，这景色春意盎然。这是女主人公乍一放眼就看到的自然美，与一般人的赏春并没有什么不同，还未充分显现出她观景的独特感受。　　“双燕飞来垂柳院，小阁画帘高卷”作者在写景中表现主人公观景有一个心理过程。她乍一看春色挺美，但继而看到暮色中归来的双燕在种着垂柳的庭院中翻飞盘旋，她的心弦就被触动了，与前面两句不自觉地感到春景之美就有些不同。燕子尚能在傍晚双双归巢，那么人呢，作者没有明说，只是写这位少妇把阁中画帘高高卷起。她的卷帘，既是为了更清楚地看双飞燕，也是为了使燕子进入画梁栖宿。这一无言的卷帘动作，蕴含着她的独特而微妙的心情，既有对成双晚归的燕子的羡慕，也有只见归燕而不见归人的怨怅。双燕在这里有鲜明的映衬作用，微露了她的复杂心境。在词中，用双飞燕、双鹧鸪、双飞蝶、双鸳鸯等形象来衬托女子的孤独感，是常见的，这里也是如此。至此读者看到春色虽美，但在女主人公眼中却有一个转折，从一般的观赏到融入自己的生活体验，赏景中那种希望成双团聚的潜意识觉醒了。　　词的下片以女主人为中心，描绘她孤独凄冷的处境。　　“黄昏独倚朱阑，西南新月眉弯。”上片之景原来都为女主人公独倚栏所见，“黄昏”对应上片的“晚”，“独倚”与上片“双飞”对举，点明她的孤单处境。那么，她黄昏倚栏是为了眺望远景吗？自然不是黄昏时分，大地一片模糊，还能看见什么呢，她是在盼望远人归来。“西南新月眉弯，”月出于东而落于西，她自黄昏独倚，直到月色偏西，可见其倚栏之久，盼望之切。　　“砌下落花风起，罗衣特地春寒。”从卷帘望飞燕到倚阑盼归人而望月，地点是不断移动的。此刻人依然未归，她又来到了阶砌再伫立等待。她真是心绪不宁，在住所凡是可看到归人的地方多次徘徊。直到夜风卷起阶前的落花，拂动她的罗衣时，她才感到春寒袭人。“落花风起”再次点明了暮春的季节特征，兼有春思撩人的象征意味。“特地”可解作“特意”或“特别”，在这里作“特别”解为宜。春夜的风使她感到特别塞冷，不仅仅由于她只穿了件薄薄的罗衣，更主要是因为她的独处而不能在心头激荡着暖流，这“寒”即是天寒，更指心寒，它以全篇之力为全篇做了一个收束。　　这是一首闺情词词中表露的是女主人公那种淡淡的哀怨与怅恨，于微婉的格调中流动着丝丝思情。此类写女子独居伤怀、望夫归来的题材，在《花间集》词作中常见。作者大多善于摄取微细的生活镜头，融入特定的自然景象，来表现女主人公的感受。这首词也体现了花间派的这种创作特色。","雨后初晴，傍晚淡烟弥漫，碧绿的春水涨满新池。双燕飞回柳树低垂的庭院，小小的阁楼里画帘高高卷起。黄昏时独自倚着朱栏，西南天空挂着一弯如眉的新月。台阶上的落花随风飞舞，罗衣显得格外寒冷。"
"捣练子令·深院静","五代","李煜","深院静，小庭空，断续寒砧断续风。无奈夜长人不寐，数声和月到帘栊。","宋词三百首，婉约，孤独","砧（zhēn）：捣衣石。寒砧：寒夜捣帛声。古代秋来，家人捣帛为他乡游子准备寒衣。栊：窗户。","　　这是一首本义词。白练是古代一种丝织品，其制作要经过在砧石上用木棒捶捣这道工序，而这工序一般都是由妇女操作的。这首词的词牌即因其内容以捣练为题材而得名。　　作者通过对一个失眠者夜听砧上捣练之声的描绘，写出了抒情主人公内心的焦躁烦恼。但作者却为这种忐忑不宁的心情安排了一个十分幽静寂寥、空虚冷漠的环境。头两句乍一看仿佛是重复的，后来汤显祖在《牡丹亭》里就写出“人立小庭深院”的句子，把“深院”和“小庭”基本上看成同义词。其实这两句似重复而并不重复。第一句是诉诸听觉，第二句是诉诸视觉。然而尽管耳在听目在看，却什么也没有听到和看到。这样，“静”和“空”这两个字，不仅在感受上给人以差别，而且也看出作者在斟酌用词时是颇费了一番心思的。至于“深院”，是写居住的人远离尘嚣；“小庭”则写所居之地只有一个空荡荡的小小天井，不仅幽静，而且空虚。头两句看似写景，实际是衬托出主人公内心的寂寞无聊。只有在这绝对安静的环境里，远处被断续风声吹来的砧上捣练之声才有可能被这小庭深院的主人听到。　　第三句是这首词的核心。自古以来，砧上捣衣或捣练的声音一直成为夫妇或情人彼此相思回忆的诗料；久而久之，也就成为诗词里的典故。比如李白在《子夜吴歌》的第三首里写道：“长安一片月，万户捣衣声。秋风吹不尽，总是玉关情。何日平胡虏，良人罢远征？”杜甫的一首题为《捣衣》的五律也说：“亦知戍不返，秋至拭清砧。已近苦寒月，况经长别心。宁辞捣衣倦，一寄塞垣深。用尽闺中力，君听空外音。”李杜两家所写，是从捣衣人的角度出发的。而李煜这首词却是从听砧声的人的角度来写的。这个听砧的人不管是男是女，总之是会因听到这种声音而引起相思离别之情的。不过，第三句虽连用两次“断续”字样，含义却不尽相同。一般地说，在砧上捣衣或捣练，总是有节奏的，因此一声与一声之间总有短暂的间歇，而这种断续的有节奏的捣练声并没有从头至尾一声不漏地送入小庭深院中来。这是因为风力时强时弱，风时有时无，这就使身居小庭深院中的听砧者有时听得到，有时听不到。正因为“风”有断续，才使得砧声时有时无，若断若续。这就把一种诉诸听觉的板滞沉闷的静态给写活了。下面两旬，明明是人因捣练的砧声搅乱了自己的万千思绪，因而心潮起伏，无法安眠；作者却偏偏翻转过来倒果为因，说人由于夜长无奈而睡不着觉，这才使砧声时断时续地达于耳畔。而且夜深了，砧声还在断断续续地响，是伴随着月光传入帘栊的。这就又把听觉和视觉相互结合起来，做到了声色交融——秋月的清光和捣练的音响合在一起，共同触动着这位“不寐”者的心弦。然而作者并没有绘声绘色，大事渲染，只是用单调的砧声和素朴的月光唤起了读者对一个孤独无眠者的同情。这正是李煜写词真正见功力的地方。　　前人评论李煜词的特点，都说他不假雕饰，纯用白描。其实李煜写词何尝不雕饰呢，只是洗尽铅华，摆脱了尘俗的浓妆艳抹，使人不觉其雕饰的痕迹而已。这首小词无论结构、布局、遣辞、造句，作者都经过了严密的构思和细致的安排，而给予读者的感受，却仿佛只是作者的自然流露。一个作家能于朴实无华之中体现匠心，才是真正的白描高手。","秋风送来了断续的寒砧声，在小庭深院中，听得格外真切。夜深了，月光和砧声穿进帘栊，更使人联想到征人在外，勾起了绵绵的离恨和相思。因而长夜不寐，愁思百结。"
"摊破浣溪沙·菡萏香销翠叶残","五代","李璟","菡萏香销翠叶残，西风愁起绿波间。还与韶光共憔悴，不堪看。细雨梦回鸡塞远，小楼吹彻玉笙寒。多少泪珠何限恨，倚栏干。(栏 通：阑) (何限恨 一作：无限恨)","宋词三百首，婉约，闺怨，写景，荷花，思念","摊破浣溪沙：词牌名。又名“添字浣溪沙”“山花子”“南唐浣溪沙”。双调四十八字，前阕三平韵，后阕两平韵，一韵到底。前后阕基本相同，只是前阕首句平脚押韵，后阕首句仄脚不押韵。后阕开始两句一般要求对仗。这是把四十二字的“浣溪沙”前后阕末句扩展成两句，所以叫“摊破浣溪沙”。菡萏：荷花的别称。西风愁起：西风从绿波之间起来。以花叶凋零，故曰“愁起“。鸡塞：亦作鸡禄山。这里泛指边塞。彻：大曲中的最后一遍。“吹彻“意谓吹到最后一曲。笙以吹久而含润，故云”寒“。玉笙寒：玉笙以铜质簧片发声，遇冷则音声不畅，需要加热，叫暖笙。","　　李璟流传下来的词作不多，所传几首词中，最脍炙人口的，就是这首《摊破浣溪沙》（有些本子作《浣溪沙》）。　　词的上片着重写景。菡萏，荷花的别称。文字的语言是形象的，所以作者一上来就说：“菡萏香销翠叶残”。说“香”，点其“味”；说“翠”，重其“色”。此时味去叶枯确然使人惆怅。西风，秋风之谓也。绿波，写的是莹莹秋水。如果说上句是重在写秋色，那么这一句则重在写秋容。一个“愁”字，把秋风和秋水都拟人化了，于是，外在的景物也霎时同作家的内在感情溶为一体了，词作也因之而笼罩了一层浓重的萧瑟气氛。三、四两句，由景生情，更进一步突出作家的主观感受。韶光，指春光。在这里，作家以其独特而深刻的感受告诉人们：在这秋色满天的时节，美好的春光连同荷花的清芬、荷叶的秀翠，还有观荷人的情趣一起憔悴了，在浓重的萧瑟气氛中又平添了一种悲凉凄清的气氛。“不堪看”三字，质朴而有力，明白而深沉，活脱脱地抒发了诗人的主观感情。“自古逢秋悲寂寥”（唐刘禹锡诗句）。李璟虽然位高为皇帝，但是生性懦弱，再加上当时内外矛盾重重，境遇相当危苦，此时此刻，触景伤情，从而产生无穷的痛苦和哀怨是十分自然的。　　词的下片着重抒情。首句，托梦境诉哀情。一梦醒来，雨声细细，梦境即便美好，但所梦之人毕竟远在边塞（鸡塞，鸡麓塞，在今陕西省。这里泛指边塞），可思可望而不可即。的确是“雨亦绵绵，思亦绵绵”。“小楼”句，以吹笙衬凄清。风雨高楼，玉笙整整吹奏了一曲（彻，遍，段。吹彻，吹完最后一段），因吹久而凝水，笙寒而声咽，映衬了作家的寂寞孤清。这两句亦远亦近，亦虚亦实，亦声亦情，而且对仗工巧，是千古传唱的名句。最后两句，直抒胸臆。环境如此凄清，人事如此悲凉，不能不使人潸然泪下，满怀怨恨。“多少”，“何限”，数不清，说不尽。流不完的泪，诉不尽的恨；泪因恨洒，恨依泪倾。语虽平淡，但很能打动人心。结语“倚栏干”一句，写物写人更写情，脉脉深长，语已尽而意无穷。　　这首词有些版本题名“秋思”，看来是切合的。李廷机评论过这首词是“字字佳，含秋思极妙”（《全唐五代词》四四一页）。确实，它布景生思，情景交融，其有很强的艺术感染力。","荷花落尽，香气消散，荷叶凋零，深秋的西风拂动绿水，使人愁绪满怀。美好的人生年华不断消逝。与韶光一同憔悴的人，自然不忍去看（这满眼萧瑟的景象）。细雨绵绵，梦境中塞外风物缈远。（醒来）寒笙呜咽之声回荡在小楼中。（想起故人旧事），（她）含泪倚栏，怀抱无穷幽怨。"
