"喜迁莺·晓月坠","五代","李煜","晓月坠，宿云微，无语枕频欹。梦回芳草思依依，天远雁声稀。啼莺散，馀花乱，寂寞画堂深院。片红休埽尽从伊，留待舞人归。","写景，时光，思念","喜迁莺：词牌名。坠：落下。微：疏淡。欹（qī）：斜倚。馀（yú）花：馀即余，残花。埽（sào）：扫去。尽从伊：这里指全由落花，任凭它飘落一地。","","拂晓的月亮坠下蓝天，夜空云雾已经微淡，默默无语倚在枕上。梦醒仍恋芳草绵绵，雁声消失遥远天边。啼晓的黄莺散，零落的飞花乱，只留下寂寞画堂深深院。任落红遍地休扫它，留待跳舞人回当地毯。"
"鹊踏枝·几日行云何处去","五代","冯延巳","几日行云何处去？忘却归来，不道春将暮。百草千花寒食路，香车系在谁家树？泪眼倚楼频独语。双燕来时，陌上相逢否？撩乱春愁如柳絮，依依梦里无寻处。(依依 一作：悠悠)","宋词三百首，闺怨，女子，孤独","","",""
"子夜歌·人生愁恨何能免","五代","李煜","人生愁恨何能免，销魂独我情何限！故国梦重归，觉来双泪垂。高楼谁与上？长记秋晴望。往事已成空，还如一梦中。","爱国，思怀","子夜歌：此词调又名《菩萨蛮》、《花问意》、《梅花句》、《晚云烘日》等。此词于《尊前集》、《词综》等本中均作《子夜》，无“歌”字。何能：怎能。何：什么时候。免：免去，免除，消除。销魂：同“消魂”，谓灵魂离开肉体，这里用来形容哀愁到极点，好像魂魄离开了形体。独我：只有我。何限：即无限。重归：《南唐书·后主书》注中作“初归”。全句意思是说，梦中又回到了故国。觉来：醒来。觉：睡醒。垂：流而不落之态。谁与：同谁。长记：永远牢记。秋晴：晴朗的秋天。这里指过去秋游欢l青的景象。望：远望，眺望。还如：仍然好像。还：仍然。","　　这首词的上片写作者感怀亡国的愁恨和梦回故国的痛苦。　　起首二句由悲叹、感慨而入，用直白的方式抒发胸中的无限愁恨。“人生”句是一种感叹，也是对生活的一种抽象概括，既是说自己，也是说众生，其“愁恨”自有一番别样的滋味，“愁”是自哀，也是自怜，是自己囚居生活的无奈心情：“恨”是自伤，也是自悔，是自己亡国之后的无限追悔。也正因有如此“愁恨”，作者才“销魂独我情何限”，而句中“独我”语气透切，词意更进，表现了作者深切体会的一种特殊的悲哀和绝望。正如俞陛云《南唐二主词集述评》中所云：“起句用翻笔，明知难免而自我销魂，愈觉埋愁之无地。”第三句“故国梦重归”是把前两句关于愁恨的感慨进一步的具体化和个人化。李煜作为亡国之君，自然对自己的故国有不可割舍的情感，所以定会朝思夜想。可是事非昨日，人非当年，过去的欢乐和荣华只能在梦中重现，而这种重现带给作者却只能是悲愁无限、哀情不已，所以一觉醒来，感慨万千、双泪难禁。“觉来双泪垂”不仅是故国重游的愁思万端，而且还有现实情境的孤苦无奈，其中今昔对比，抚今追昔，反差巨大，情绪也更复杂。　　词的下片续写作者往日成空、人生如梦的感伤和悲哀。　　“高楼谁与上”是无人与上，也是高楼无人之意，进一步点明作者的困苦环境和孤独心情。所谓登高望远，作者是借登高以远眺故国、追忆故乡。故国不可见，即便可见也已不是当年之国，故乡不可回，此恨此情只能用回忆来寄托。所以作者的一句“长记秋晴望”，实是一种无可奈何的哀鸣。现实中的无奈总让人有一种空虚无着落之感，人生的苦痛也总给人一种不堪回首的刺激，作者才有“往事已成空，还如一梦中”的感慨。在现实中，“往事”真的“成空”。但这种现实却是作者最不愿看到的，他希望这现实同样是一场梦。“如一梦”不是作者的清醒，而是作者的迷惘，这种迷惘中有太多的无奈，以此作结，突显全词的意境。　　全词以“梦”为中心，集中写“空”，笔意直白，用心挚真。全词八句，句句如白话入诗，以歌代哭，不事雕琢，用情挚切。全词有感慨，有追忆，有无奈，有悲苦，这一切因其情真意深而感人不浅，同时也因其自然流露而愈显其曲致婉转。","人生的愁恨怎能免得了？只有我伤心不已悲情无限！我梦见自己重回故国，一觉醒来双泪垂落。有谁与我同登高楼？我永远记得一个晴朗的秋天，在高楼眺望。往事已经成空，就仿佛在梦中一般。"
"忆江南·多少泪","五代","李煜","多少泪，沾袖复横颐。心事莫将和泪滴，凤笙休向月明吹，肠断更无疑。","抒情，思念，故国","","",""
"菩萨蛮·枕前发尽千般愿","五代","佚名","枕前发尽千般愿，要休且待青山烂。水面上秤锤浮，直待黄河彻底枯。白日参辰现，北斗回南面。休即未能休，且待三更见日头。","宋词三百首，婉约，爱情","","　　它没有文人词深婉曲折的风致和含蓄蕴藉的神韵。从写法上的铺排、衬字的运用、表意的泼辣直露看，似元曲。但又无元曲的圆熟流丽、挥洒曲折。然而它却激动人心，千古不衰。　　原因在于主人以忠贞热烈的感情激发的想象和这种想象的感染力。词中的想象多样而新奇。主人公一连想到六种自然景物和非现实现象。青山、水面、黄河、参辰、北斗、日头，这些是习见的，并不奇。但经浪漫主义的想象之后，立刻变得引人入胜了。这些奇想反复表达了主人公的愿望，使人感到分明有一种“理”在：真正的爱情不一定是已经长久不分的，而是希望天长地久的。如果没有这种希望，整日厮守也徒然，有这种希望，即使天涯海角甚至人间天上的分离也美满。在主人公的眼中，爱情与山河同在，与日月共存。夸张地强调了爱情永固，但又不觉得过分，读者只为主人公崇高的感情而激动。相形之下，那些不严肃的爱情观是多么暗淡、空虚和渺小。由羡慕进而想到主人公如此之情是怎样产生的。　　尽管因素多种，依现在的理解，最重要的是它有充实的内容。但词中却只字未提，明快而又耐人寻味。诗中的想象是广阔大胆的。由大地到天空是其想象的空间，由山河到星日是其想象的对象。以宇宙间最雄伟的景物来烘托爱情，敢于把爱的生命与永恒的宇宙并提，形成一种奇妙的类比推理：青山不会烂，水面浮不起秤锤，黄河不会枯竭，参星和辰星不会在白天出现，北斗不会回到南天，半夜不会升起太阳，爱情不会中断。这样的类推也可说是理不通而情通，无理而妙。诗中提到的自然现象都遵循一个共同的规律，存在于天地之间，根据人们的经验，这规律是万古不变的。词中主人公正是依据这些自然现象与爱情理想在时间上的相似点，进行想象的。但未从正面写，却将爱的中止与这些规律的改变联系起来让前者发生在后者之后，由于后者是不会实现的，前者就不会发生。爱情永存的愿望被表现得十分生动有力，体现了从反面写与从正面写的不同效果。对可能出现的意外的担心，是更深的爱。愿其长久和害怕失去虽然意思相近，但后者对于对象的珍爱远胜前者，往往是精神上难以缺少的。诗中的奇伟想象正是由这深情所激发，而想象又使感情表达得更真挚、明朗、坚定、感人。","注释 菩萨蛮：词牌名。近人杨宪益《零墨新笺》考证《菩萨蛮》为古缅甸曲调，唐玄宗时传入中国，列于教坊曲。变调，四十四字，两仄韵，两平韵。②休：罢休，双方断绝关系。 参辰：星宿名。参星在西方，辰星（即商星）在东方，晚间此出彼灭，不能并见；白天一同隐没，更难觅得。 北斗：星座名，以位置在北、形状如斗而得名。 即：同“则”。"
"木兰花·晚妆初了明肌雪","五代","李煜","晚妆初了明肌雪，春殿嫔娥鱼贯列。笙箫吹断水云间，重按霓裳歌遍彻。临春谁更飘香屑？醉拍阑干情味切。归时休放烛光红，待踏马蹄清夜月。","宴饮，音乐，生活","此词调《木兰花》，《全唐诗》注曰：“一名《玉楼春》，一名《春晓曲》，一名《惜春容》。”《草堂诗余》、《词的》、《古今词统》、《古今诗余醉》等本中有题作“宫词”。晓妆：一作“晚妆”。《全唐诗》中作“晓妆”。晓妆初了，晓妆刚结束。初了，刚刚结束。明肌雪：形容肌肤明洁细腻，洁白如雪。春殿：即御殿。以其豪华、盛大而称“春殿”。李白《越中览古》诗有“宫女如花满春殿”之句。嫔（pín）娥：这里泛指宫中女子。鱼贯列：像游鱼一样一个挨一个地依次排列，这里指嫔娥依次排列成行的样子。笙箫吹断水云间：笙箫，《词综》、《历代诗余》、《古今词统》、《全唐诗》等本作“凤箫”。《花草粹编》作“笙歌”。笙箫，笙和箫，泛指管乐器。吹断，吹尽。水云间，吕本二主词、侯本二主词、吴本二主词于“间”处空格。《全唐诗》、《花草粹编》、《古今词统》、《词综》等本中均作“水云闲”；《松隐文集》作“水云中”。水云间即水和云相接之处，谓极远。重按霓（ní）裳歌遍彻：重按，一再按奏。按，弹奏。霓裳，《霓裳羽衣曲》的简称。唐代宫廷著名法曲，传为唐开元年间河西节度使杨敬忠所献。初名《婆罗门曲》，后经唐玄宗润色并配制歌词，后改用此名。唐白居易《琵琶行》中有句：“轻拢慢捻抹复挑，初为《霓裳》后《六幺》。”歌遍彻，唱完大遍中的最后一曲，说明其歌曲长、久，音调高亢急促。遍，大遍，又称大曲，即整套的舞曲。大曲有排遍、正遍、遍、延遍诸曲，其长者可有数遍之多。彻，《宋元戏曲史》中云：“彻者，入破之末一遍也”，六一词《玉楼春》有“重头歌韵响铮，入破舞腰红乱旋”之句，可见曲至入破以后则高亢而急促。临春：《词综》、《历代诗余》、《古今词统》、《全唐诗》等本中均作“临风”。郑骞《词选》中云：“临春，南唐宫中阁名，然作‘临风’则与‘飘’字有呼应，似可并存。”香屑：香粉。飘香屑：相传后主宫中的主香宫女，拿着香粉的粉屑散布于各处。醉：心醉、陶醉。拍：拍打，这里兼有为乐曲击出拍节之意。阑干：即栏杆。情味：《花草粹编》、《词谱》、《全唐诗》、《词林纪事》等本中均作“情未”。切：恳切，真挚而迫切的心情。归：回。休放：《词综》、《词谱》、《历代诗余》、《全唐诗》等本中同此。萧本二主词、吕本二主词、吴本二主词、《词林纪事》、《类编草堂诗余》等本中均作“休照”。烛光：晨本二主词中同此；吕本二主词、吴本二主词、萧本二主词、《花草粹编》、《词综》、《词谱》、《全唐诗》等本中均作“烛花”。烛光红，指明亮的烛光。待踏：《词综》、《历代诗余》、《词谱》、《全唐诗》等本中同此。吕本二主词、萧本二主词、吴本二主词、《类编草堂诗余》等本中均作“待放”。踏马蹄：策马缓慢而行，有踏月之意。有本作“放马蹄”，意为让马随意而行。","　　此词是李煜于南唐全盛时期所创作的一篇代表作。词的上片主要写春夜宴乐的盛大场面。首句突出描绘“晚妆初了”的嫔娥们的盛妆和美艳，由此写出作者对这些明艳丽人的一片飞扬的意兴，同时从开篇即渲染出夜宴的奢华豪丽。继之两句宴乐开始，歌舞登场，作者极写音乐的悠扬和器物的华美。比如，笙箫二字可以给人一种精美、奢丽的感觉，与词中所描写的奢靡之享乐生活、情调恰相吻合。而“吹”作“吹断”，“按”作“重按”，不但字字可见作者的放任与耽于奢逸，而且十分传神地赋予音乐以强烈的感情色彩。据马令《南唐书》载：“唐之盛时，《霓裳羽衣》最为大典，罹乱，瞽师旷职，其音遂绝。后主独得其谱，乐工曹生亦善琵琶，按谱粗得其声，而未尽善也。（大周）后辄变易讹谬，颇去哇淫，繁手新音，清越可听。”李煜与大周后都精通音律，二人情爱又笃深，更何况《霓裳羽衣》本为唐玄宗时的著名大曲，先失后得，再经过李煜和周后的发现和亲自整理，此时于宫中演奏起来，自然欢愉无比。所以不仅要“重按”，而且要“歌遍彻”，由此也可想见作者之耽享纵逸之情。　　词的下片是描写曲终人散、踏月醉归的情景。“临春”一句明是写香，暗是写风，暗香随风飘散，词人兴致阑珊，由“谁更”二字而出，更显得活泼有致。“醉拍”二字直白而出，写醉态，写尽兴尽欢妥贴至极。到这里，作者有目见的欣赏，有耳听的享受，有闻香的回味，加上醉拍由口饮而生的意态，正是极色、声、香、味之娱于一处，心旷神驰，兴奋不已，因此才“情味切”，耽溺其中无以自拔。结尾二句，写酒阑歌罢却写得意味盎然，余兴未尽，所以向来为人所称誉。《弇州山人词评》中赞其为“致语也”。今人叶嘉莹曾详评此句：“后主真是一个最懂得生活之情趣的人。而且‘踏马蹄’三字写得极为传神，一则，‘踏’字无论在声音或意义上都可以使人联想到马蹄得得的声音；再则，不曰‘马蹄踏’而曰‘踏马蹄’，则可以予读者以双重之感受，是不仅用马蹄去踏，而且踏在马蹄之下的乃是如此清夜的一片月色，且恍闻有得得之声入耳矣。这种纯真任纵的抒写，带给了读者极其真切的感受。”读此二句，既可感作者的痴醉心情，也可视清静朗洁的月夜美景，更可见作者身上充盈着的文人骚客的雅致逸兴。　　全词笔法自然奔放，意兴流畅挥洒，语言明丽直快，情境描绘动人。作者从个人宫廷生活场面出发，虽然带有较为浓郁的富贵脂粉气，未能表现出深刻的思想内容，但短短一篇就把一次盛大欢宴的情形淋漓尽致地表现出来，艺术描绘生动逼真，情景刻画细腻动人，由喻象中见情思，于浅白处见悠远，充分显示了作者高妙的艺术功力，是“写得极为俊逸神飞的一首小词”。","月圆之夜，大型宫廷歌舞酒宴。出场前先是画妆。因是晚妆，为了适合舞场与烛光，画眉点唇，都不妨色泽浓艳。宫娥们刚画完妆的一刻，是何等光彩照人呀！妆毕，春殿上美女如云，她们队列整齐，鱼贯而入，虽是层层娇娘的行列，望之也顿生军旅的浩荡之感。歌罢宴散，月色更明。当即吩咐随从灭尽红烛，纯任得得马蹄，踏着一路月色归去，方见得歌舞虽散，而余兴未尽！"
"采桑子·花前失却游春侣","五代","冯延巳","花前失却游春侣，独自寻芳。满目悲凉。纵有笙歌亦断肠。林间戏蝶帘间燕，各自双双。忍②更思量，绿树青苔半夕阳。","婉约，孤独，思念","纵有：纵使有。笙歌：笙代指各种乐器；笙歌即指各种乐器演奏声和歌声。忍：作“怎忍”解。","","花前没有了她的陪伴，独自在花间徘徊，看繁花似锦，芳草天涯，一株株、一簇簇，都有他寻找的往昔旧梦，触目悲凉。虽是春光美景，却是欢乐难再，既使笙歌入耳，婉转悠扬，也只能唤起他对爱侣的追忆，从而更添感伤惆怅。转眼望去，林间彩蝶对对，帘间飞燕双双，皆在快乐嘻逐，恩爱相偕。不思量、难思量，抬头望天边，还是夕阳西沉、残阳如血。血色勾勒了天边的绿树，涂抹了林中的青苔，也笼罩了他的心，明丽而惨烈。"
"春光好·蘋叶软","五代","和凝","蘋叶软，杏花明，画船轻。双浴鸳鸯出绿汀，棹歌声。春水无风无浪，春天半雨半晴。红粉相随南浦晚，几含情。","春游","软：一作“嫩”。明：鲜艳。绿汀（tīng）：芳草丛生的水边平地。棹歌：船歌。红粉：借代为女子。几含情：屡次含着深情。李颀《采莲曲》：“时逢岛屿泊，几伴鸳鸯眠。”白居易《东南行一百韵》：“几见林抽笋，频惊燕引雏。”","　　此词作于《花间集》结集之后，所以不见于《花间集》。作品描绘的是成都的的风光和生活。词中突出了春天日光和煦、万物欣欣向荣的特点，并使描写的物象有机地组合为一体，构成一幅明丽和谐的春色图。　　此词发端以淡淡的笔墨点明时令：“天初暖，日初长。”成都四季分明，冬尽春始，景象不同。这两句写春天来了，用两“初”字，而且都是就感受着笔的。天初暖，写气候特征；日初长，写昼夜特征。两句看似平易，却是咏早春的不可移易之语。大地经过沉睡的冬季之后苏醒了。无边的春色使词人情不自禁地叫出一声“好春光”。紧接着以“万汇此时皆得意，竞芬芳”来补充“好”字的内容。万汇，包括各种竹木花树。它们新叶不同，颜色不同，花儿不同，在春风的吹拂下争奇斗艳，处处给人以竞相比美之感。词人先用一个“得意”，再用一个“竞”字，像以浓墨重彩在表现热闹的春意。　　下片写园林春色，是特写，是近景。一场春雨，竹林中新笋从点点如钱的绿苔地里迸发出来，第二句“花偎雪坞浓香”与首句“笋迸苔钱嫩绿”对仗，景致互相映衬，香色纷陈，更为突出。繁花，花团锦簇，如绰约少女依偎着雪坞，浓香四溢。词人在迷人的春色中流连忘返，不觉到了黄昏。天空泛出彩霞，他举目望去，柳丝夕阳，构成了天然图画，词人忽发奇想问道：“谁把金丝裁剪却，挂斜阳？”春柳嫩叶初萌，色如金线，故白居易《杨柳枝》说：“一树春风千万枝，嫩于金色软于丝。”均匀的柳丝，两两相对的柳叶，像天工剪裁而成。贺知章《咏柳》说：“碧玉妆成一树高，万条垂下绿丝绦。不知细叶谁裁出，二月春风似剪刀。”后二句人称神来之笔，欧阳炯化用其意以写早春园林夕照，创造了新的意境，余味无穷。","水上柔嫩的苹叶，衬着岸边洁的杏花；翠红美丽的鸳鸯，拖着长长的绿漪浮漾。一叶轻盈的画摇出船，添几阕情韵袅袅的“棹歌”。春光，轻灵摇荡，明媚可人！水，好在无风无浪；天，好在半雨半晴。在疏淡的暮霭中，伴一二红粉知已泛舟南浦，更多了几分含蕴不露的情意！"
"临江仙·饮散离亭西去","五代","徐昌图","饮散离亭西去，浮生长恨飘蓬。回头烟柳渐重重。淡云孤雁远，寒日暮天红。今夜画船何处？潮平淮月朦胧。酒醒人静奈愁浓。残灯孤枕梦，轻浪五更风。","宋词三百首，婉约，孤独，写景","饮散：饮完酒后离散。离亭：送别的驿亭。浮生：一生。古人谓“人生世上，虚浮无定”，故曰“浮生”。飘蓬（péng）：飘浮无定之意。重重（chóng chóng）：一层又一层，形容很多。暮（mù）天红：指傍晚天空一片酡红。画船：装饰华丽的船。多指游船。淮（huái）月：指照临淮水上空的月亮。朦胧（méng lóng）：模糊不清。奈：怎奈，奈何。孤枕（zhěn）梦：这里指孤枕难眠。五更风：指黎明前的寒风。 ","　　上阕写的是离别后的情景，是实写。首两句直写别离，“散”、“离”、“去”已带怨意，而一个“恨”字则是直抒胸臆，又点明本词的主题，写出了词人内心的凄凉，羁旅之恨。且这恨又是“长恨”，这就道出了“饮散”“西去”对词人来说并非第一次了，每重演一次，就会增加一分身世飘零之恨。一个“长”字，使恨的情感深化了。第三句描绘的是词人一步三回头，不忍离去的情态，“烟柳渐重重”，既写出了离愁的层层加深，也写出了离愁的“有形”情态，衬托出了行人心头的迷惘。四、五两句描绘的是作者眼中的惨淡画面。“淡云”暗示行人心头的落寞，“孤雁”则是行人的化身；“寒日”显其心头之冷，“暮天红”虽是美景，但“夕阳无限好，只是近黄昏”，又充满了伤感。这两句极写浪迹飘零之苦，是移情于景。　　下阕都是词人想象中的情景。首句以问引起下文。“潮平淮月艨胧”暗示他那离别时的剧烈情绪已逐渐平静下来，可是心头却又一片迷惘。心里空虚只能借酒浇愁，可是在短暂的麻痹之后，还是要醒来，醒来时的静夜中心头却是更加空虚，更加愁苦难耐。词人通过气氛的渲染和景物的烘托，使内心的感伤之情与外在的空冷之景交融为一，传达出词人此时此地的冷寂情怀。“酒醒人静奈愁浓”，一旦酒醒，回到现实，只能更增愁情，不是三杯两盏淡酒就冲刷得掉的。一个“奈”字，突出了词人万般无奈的苦闷心情。末两句“残灯孤枕梦，轻浪五更风”描绘的是一幅多么凄凉可怕的景象。灯里的油就要燃尽，灯火忽明忽暗；一个人躺在枕头上，没有人陪伴，想入睡做个梦都不可得；五更时的寒风吹来更是倍增寒意。而从“潮平”到“残灯”再到“五更”，足见行人一夜未睡，“愁浓”之情不虚，此情此景，人何以堪。　　全词最为独特之处当在下阕，在于虚境实写，化虚为实，而又虚中浸实，写尽羁旅之情，含蓄隽永，耐人寻味。词人巧妙地融情与景为一体，写离愁却很少直接抒情，而是借助于外在的景物来表现词人内心的离愁别恨。词人沿情布景，景物的转承和变换、环境气氛的渲染和烘托，处处反衬出词人的内心世界。","喝完饯别酒，友人们终于挥手别去，常常怨恨这种漂泊不定短暂虚浮的人生。回首看到如烟似雾的杨柳早已遮断视线。往前看去，风清云淡，孤雁远征。孤单的寒日傍晚天空一片酡红。今夜画船将停在什么地方？只怕夜间潮平水落，泊船岸边，一片清月迷漾。到酒消人也醒时，那种愁绪倍加难以排遣了。蜡烛残尽孤枕难眠；五更时轻风吹来激起点点浪花。"
"渔歌子·荻花秋","五代","李珣","荻花秋，潇湘夜，橘洲佳景如屏画。碧烟中，明月下，小艇垂纶初罢。水为乡，篷作舍，鱼羹稻饭常餐也。酒盈杯，书满架，名利不将心挂。","秋天，写景，归隐","渔歌子：词牌名。原唐教坊曲名，后成为词牌名。单调二十七字，四平韵。中间三言两句，例用对偶。荻（dí）：多年生草本植物，秋季抽生草黄色扇形圆锥花序，生长在路边和水旁。潇湘：两水名，今湖南境内。《山海经》：“潇水，源出九巅山，湘水，源出海阳山。至零陵合流而于洞庭也。”橘洲：在长沙市境内湘江中，又名下洲，旧时多橘，故又称“橘子洲”。《水经注·湘水》：“湘水又北经南津城西，西对橘洲。”垂纶（lún）：垂钓。纶，较粗的丝线，常指钓鱼线。篷：船帆，此处代指船。“名利”句：即心不将名利牵挂。","　　这首词主要描写了词人的隐逸生活。　　上片写景。开头三句点明时间、地点，是地处潇湘的橘子洲的秋夜，荻花临风，美景如画。“碧烟中”三句，将镜头渐次拉近，月光下的江水，轻柔澄碧，云烟淡淡，词中主人公刚刚垂钓完毕，划着小艇在水上荡漾。真是如诗如画，如梦如幻。　　下片写人事，主要写词人的隐逸生活及其乐趣。隐在民间，云水就是家乡，蓬舍就是住所，经常吃的是家常的鱼羹稻米饭。杯中斟满美酒，架上摆满书籍，开怀惬意，其乐陶陶，绝不把名利挂在心上。　　词人淡淡地写景，不事雕琢，明白如话，把一个一个远离名利，以隐逸为乐的词人的内心活动真实地展示出来，旷达超脱，余韵悠悠，受中唐张志和《渔父》词的影响颇大。","潇湘的静夜里，清风吹拂着秋天的荻花，橘子洲头的美景，宛如屏上的山水画。浩淼的烟波中，皎洁的月光下，我收拢钓鱼的丝线，摇起小船回家。绿水就是我的家园，船篷就是我的屋舍，山珍海味也难胜过我每日三餐的糙米鱼虾。面对盈杯的水酒，望着诗书满架，我已心满意足，再不用将名利牵挂。"
